{"compatibility":{"core_maximum_exclusive":"2.0.0","core_minimum":"1.2.0","plugin_api_major":1,"rpc_api_major":1},"electron_version":"44.2.0","extraction_limits":{"max_entries":64,"max_file_bytes":524288,"max_path_bytes":256,"max_total_bytes":1048576},"files":[{"byte_count":83,"executable":false,"path":"runtime/LICENSES.json","sha256":"e0e7489ddde27e36fe2a9ae991a0654f1e2afef3446157cef4d685a8efd12706"},{"byte_count":59,"executable":true,"path":"runtime/chrome-sandbox","sha256":"81e10af453faeb89a1472769e467621d412594f21dcb0447ad96c21d6af86915"},{"byte_count":59,"executable":false,"path":"runtime/libEGL.so","sha256":"2e514b038af99fc7b3eab326696d9401d8b22caf36ab18245180317d8faa2f22"},{"byte_count":66,"executable":false,"path":"runtime/resources/app.asar","sha256":"3baa235a2059ad8b248610ce5b954741d1ac5f6793e2c47c89f5a6a0881c08a9"},{"byte_count":63,"executable":true,"path":"runtime/tongs-desktop","sha256":"809cc0cd8eb3a80b396fa885efa9112f3386c2305fcb72c66f5a11a1b0de5670"},{"byte_count":29,"executable":false,"path":"runtime/version","sha256":"2c94acd46b55eb45196e3019c14310c2cd45021f74718a093ba9dddbf150acba"}],"launcher_path":"runtime/tongs-desktop","ownership":"per-user","package_kind":"user-archive","platform":{"abi":"gnu","architecture":"x86_64","distribution":"fedora","distribution_version":"44","operating_system":"linux"},"release_version":"1.2.3","schema_version":1}
